{"allowedApplicationSigner":{"kind":"appleDesignatedRequirement","value":"identifier com.example.desktopUpdaterSmoke and anchor apple generic"},"allowedHelperSigner":{"kind":"appleDesignatedRequirement","value":"identifier com.example.desktopUpdaterSmoke.helper and anchor apple generic"},"allowedInstallRoots":["/Applications"],"allowedStrategies":[{"provider":"platformDirectory","strategy":"directoryReplace"},{"provider":"macosInstaller","strategy":"verifiedInstallerHandoff"}],"allowedTargetClasses":["applicationBundle","protectedApplication"],"applicationPackageId":"com.example.desktopUpdaterSmoke","helperServiceId":"com.example.desktopUpdaterSmoke.helper","minimumHelperProtocolVersion":1,"policyId":"com.example.desktopUpdaterSmoke.privileged","policyVersion":3,"releaseRootPublicKeys":[{"algorithm":"ed25519","keyId":"native-runtime-smoke-stable","publicKeyBase64":"uvxxvq06xeS2PpyCFu5xo0quxlci7tvKcotOmzzM45Y="}]}
