{"allowedApplicationSigner":{"kind":"appleDesignatedRequirement","value":"identifier net.monolib.updater"},"allowedHelperSigner":{"kind":"appleDesignatedRequirement","value":"identifier net.monolib.updater.helper"},"allowedInstallRoots":["/Applications","/Applications/DesktopUpdaterSMAppServiceSmoke"],"allowedStrategies":[{"provider":"platformDirectory","strategy":"directoryReplace"},{"provider":"macosInstaller","strategy":"verifiedInstallerHandoff"}],"allowedTargetClasses":["applicationBundle","protectedApplication"],"applicationPackageId":"net.monolib.updater","helperServiceId":"net.monolib.updater.helper","minimumHelperProtocolVersion":1,"policyId":"net.monolib.updater.privileged.debug","policyVersion":3,"releaseRootPublicKeys":[{"algorithm":"ed25519","keyId":"native-runtime-smoke-stable","publicKeyBase64":"uvxxvq06xeS2PpyCFu5xo0quxlci7tvKcotOmzzM45Y="}]}
